,score,explanation,score_together,explanation_together
OPENING,5,"The physician clearly introduces themselves by stating, ""Good. I'm Cheyenne. I'm a medical student."" They clarify their role and purpose by mentioning, ""And I'm going to talk to you for a little bit before the doctor comes in, if that's okay."" Additionally, they respectfully inquire about the patient's preferred form of address with, ""Now what would you like me to call you?"" and use the patient's name at the beginning, ""Hi, Mrs. McCullough. How are you?"" Thus, the introduction includes all the necessary elements of a full introduction as per the criteria.",5,"The physician introduces themselves, clarifies their role, and inquires how to address the patient, using the patient's name. The physician says, ""Hi, Mrs. McCullough. How are you?"" and later asks, ""Now what would you like me to call you?"" The patient responds with ""Mrs. McCullough or Velma, whichever one you're more comfortable with."" This meets all the criteria for a full introduction."
ELICITS SPECTRUM OF CONCERNS,4,"The interviewer effectively elicits the patient's primary concern, which is the desire to start an exercise program due to increasing tiredness and potential health benefits. The interviewer asks, 'Is there anything else that you're concerned about?' fairly early in the conversation, to which the patient responds 'No.' This indicates an attempt to probe for more concerns but does not include a follow-up 'what else' to ensure all possible concerns are fully explored. Additionally, throughout the conversation, the interviewer gathers a comprehensive medical history, discusses potential exercise options considering the patient's preferences and limitations, and explores barriers to exercise, such as varicose veins and concerns about gym environments. However, the focused approach on the exercise topic without revisiting the question of additional concerns or probing deeper for possibly related or entirely different health concerns means that while secondary concerns related to the main concern are addressed, the interviewer does not explicitly ask 'what else' until no additional concerns are raised after the initial question. Therefore, the interviewer misses an opportunity to explore the patient's full spectrum of concerns beyond the initial exercise query and related medical history.",3,"The physician asks the patient about their concerns and reasons for visiting the office, and the patient mentions wanting to start an exercise program due to feeling tired. The physician asks follow-up questions to gather more information about the patient's medical history, lifestyle, and goals. However, the physician only asks ""Is there anything else that you're concerned about?"" once, and the patient responds with ""No."" The physician does not repeatedly ask ""what else"" to elicit the patient's full spectrum of concerns."
NEGOTIATES PRIORITIES & SETS AGENDA,5,"The interviewer effectively listens to the patient's concerns, asks follow-up questions to gather a comprehensive understanding of the patient's health, lifestyle, and motivations for wanting to start an exercise program. They engage the patient in setting a plan for initiating an exercise regimen, considering personal preferences, family involvement, and potential barriers like health issues and self-consciousness about appearance. The interviewer ensures that the patient's concerns, such as the history of surgeries, current medications, family medical history, and potential gym-related anxieties, are addressed. They also plan to involve other healthcare professionals (like a physical therapist) to address specific concerns (back pain), showing a thorough approach to care. The plan for exercise is formed through negotiation, taking the patient's input into account, and setting a clear, mutually agreed-upon agenda for the next steps, including follow-up appointments. The interviewer also ensures understanding by asking the patient to recap the plan, ensuring mutual agreement and understanding. Thus, the interviewer effectively negotiates the priorities of the patient's concerns, lists all relevant concerns, and sets an initial agenda for addressing the primary concern (starting an exercise program) with the patient's agreement, fulfilling the criteria for a score of 5.",4,"The physician does a good job of gathering the patient's concerns and setting an agenda, but there are some areas for improvement. The physician asks open-ended questions to elicit the patient's concerns and actively listens to her responses. The physician also summarizes the patient's concerns and sets an agenda for the visit, obtaining the patient's agreement. However, the physician does not explicitly negotiate priorities with the patient or ask the patient to rank their concerns in order of importance. Additionally, the physician jumps into the medical history and physical examination without fully exploring the patient's concerns and expectations."
ELICITING THE NARRATIVE THREAD or the ‘PATIENT’S STORY’,5,"The interviewer provides the patient with plenty of opportunities to share her concerns and story without dominating the conversation. The patient is encouraged to talk about her goals, medical history, family history, and her anxieties regarding starting an exercise program. Throughout the conversation, the physician gives the patient room to express her thoughts, fears, and experiences, only interjecting to clarify or guide the conversation to relevant topics without abrupt interruptions or shifts in topic. The interviewer also ensures the patient understands the plan moving forward by inviting her to recap the agreed-upon steps. This approach maintains focus and allows for a complete narrative thread of the patient's situation and needs.",3,"The physician allows the patient to share their story and concerns, but occasionally interrupts with focused questions or introduces unrelated topics. The physician asks open-ended questions, such as ""So what brings you into the office today?"" and ""Tell me about your exercise history,"" which encourages the patient to share their narrative. However, the physician also interrupts with specific questions, like ""How old are you?"" and ""Do you take any medications?"" which breaks the narrative thread. Additionally, the physician introduces new topics, such as the patient's family history and stressors, which, although relevant, disrupt the patient's flow of thought."
TIMELINE,5,"The interviewer demonstrated a comprehensive approach to establishing a timeline and chronology of the patient's chief concern and history of the present illness. By asking about the duration of exercise interests ('Well, I've been tired for the last almost year. You know, it seems to be getting progressively worse'), and probing into the onset and progression ('No, because it wasn't a sudden jump. It was just, like, gradually getting more and more tired as the year went on.'), the interviewer effectively set a clear timeline related to the chief concern. Additionally, the discussion of medical history, surgeries, and medication use ('Yeah. I have high cholesterol.' 'Yes. I've had twice surgery.') added essential context to the patient's overall health status and potential factors influencing the desire to initiate an exercise program. The interviewer's follow-up on how the patient's medical history and physical condition may impact exercise choices further solidified the establishment of a detailed chronology and understanding of the patient's health and exercise motivations. Thus, the interviewer obtains sufficient information to establish a clear chronology of the chief concern and history of the present illness, meriting a score of 5.",5,"The physician establishes a good chronology of the patient's chief concern (tiredness) and history of the present illness, including the sequence of associated symptoms and events. The physician asks open-ended questions to gather information about the patient's medical history, family history, and lifestyle, which helps to understand the context of the patient's tiredness. The physician also explores the patient's motivation for starting an exercise program and identifies potential barriers to exercise, such as varicose veins and back pain."
ORGANIZATION,5,"The conversation between the medical student and the patient follows a logical and organized structure, beginning with introductions and progressing through questions designed to gather a comprehensive understanding of the patient's medical history, current health concerns, family history, and lifestyle. The medical student transitions smoothly from understanding the patient's reason for the visit, to collecting relevant health information, discussing exercise interests, and addressing potential concerns and barriers to exercise. The interview progresses seamlessly into planning for the patient’s exercise program, with thoughtful consideration of the patient's personal and family health history, current physical condition, and lifestyle preferences. The time is effectively used to cover a broad range of topics important for designing a personalized exercise plan, indicating tasks were completed within the time allowed.",5,"The physician's questions follow a logical order, starting with the patient's concerns and medical history, then moving on to their exercise history, daily routine, and stressors. The physician also effectively uses time to cover all necessary topics, including the patient's goals, potential barriers, and plans for starting an exercise program. The conversation flows smoothly, with the physician summarizing and clarifying the patient's understanding of the plan at the end."
TRANSITIONAL STATEMENTS (only for complete histories),5,"The interviewer consistently uses transitional statements to guide the patient through the different sections of the interview, effectively transitioning from initial introductions to discussing the patient's medical history, exercise interests, family history, and eventually, forming a plan for exercise. These transitions are smooth, logical, and serve to inform the patient about the direction of the conversation. For example, after discussing the patient's reason for visiting, the interviewer states, 'Great. So then what I'm going to do is I'm going to ask you a few questions to get a medical history and some reasons behind your wanting to do an exercise program, and then we can get into talking about how to start that.' This statement clearly outlines the structure of the interview for the patient. Furthermore, when transitioning to devising an exercise plan, the interviewer lays out the steps involved: 'Well, let's see. How about we think about your starting a gym program and talking to your daughter, Lucy, and trying to get her involved in that with you.' These examples illustrate the interviewer's effective use of transitional statements to navigate different topics, making the purpose of each segment clear to the patient.",5,"The interviewer uses transitional statements effectively throughout the interview, clarifying the interview's structure for the patient. For example, ""So what I'm going to do is I'm going to ask you a few questions to get a medical history and some reasons behind your wanting to do an exercise program, and then we can get into talking about how to start that. Does that sound okay?"" (transitional statement introducing the medical history section). The interviewer also uses phrases like ""Let's see"" and ""So"" to connect ideas and signal a shift in topics. Additionally, the interviewer summarizes the discussion at the end, ensuring the patient understands the agreed-upon plan."
PACING OF INTERVIEW (not based on finishing on time),5,"Throughout the conversation, the interviewer (medical student) maintains a fully attentive and patient-centric approach, never interrupting Mrs. McCullough's responses and smoothly facilitating a comprehensive discussion about her health, exercise interests, and potential plans. The interviewer skillfully uses silence and patient responses to gauge Mrs. McCullough's comfort level and preferences, such as when inquiring about what name she prefers to be called, her exercise history, and her family medical history. Every transition from one topic to another is natural and seamless, reinforcing the sense of a thoughtfully paced interview. There are no observable awkward pauses that detract from the dialogue's flow. Instead, the use of pauses seems deliberate, allowing the patient to think and respond thoroughly. The interviewer's questions and summarizations of the patient's statements guide the conversation effectively without rushing or halting it unnaturally.",5,"The physician demonstrates attentiveness to the patient's responses, listens without interruption, and the interview progresses smoothly without awkward pauses. The physician uses silence deliberately, allowing the patient to fully respond to questions before moving on to the next topic. The physician also uses open-ended questions to encourage the patient to share more information, and actively engages with the patient's responses. The pace of the interview is comfortable, and the physician takes the time to explain complex concepts and ensure the patient understands the plan."
QUESTIONING SKILLS – TYPES OF QUESTIONS,5,"The interviewer, in this case, a medical student, begins each major line of questioning with an open-ended question, effectively inviting the patient to share more about her concerns, medical history, family life, and exercise preferences in a broad, conversational manner. For instance, questions like 'So what brings you into the office today?' and 'Tell me why you want to start an exercise program.' are open-ended and initiate a line of inquiry that allows for comprehensive patient responses. Following these openers, more specific questions are used to delve deeper into the patient's history and concerns, e.g., 'Do you have any medical problems, anything that you know of?' and 'Have you ever had any surgeries?'. This structure demonstrates a strategic approach to gathering detailed information while maintaining a patient-centered dialogue. Each major inquiry section begins with an open-ended question, and subsequent questions are tailored to elicit specific information relevant to the patient's initial responses without leading, using multiple questions in one, or asking 'why' in a manner that might be perceived as judgmental. There are no instances of poorly structured questions that detract from the quality of information gathered, fulfilling the criteria for a score of 5.",5,"The physician starts the conversation with open-ended questions, such as ""So what brings you into the office today?"" and ""Tell me about your exercise history."" These questions encourage the patient to share more information and set the tone for a collaborative conversation. The physician also uses specific and direct questions to gather more detailed information, such as ""How old are you?"" and ""Do you take any medications?"" The sequence of questions is logical and follows a clear pattern, moving from general to specific topics."
QUESTIONING SKILLS - SUMMARIZING,5,"Throughout the conversation, the interviewer (medical student) methodically gathers information about the patient's medical history, exercise intentions, and lifestyle, and utilizes summarization techniques to verify the obtained information at several points. For instance, the interviewer summarizes the discussion about the patient's motivation for starting an exercise program and her medical background with: 'So you are interested in starting an exercise program because you've been a little bit more tired lately and you think it might be due to lack of exercise. And you've thought a little bit about starting a program. And I've asked you about your medical history, so I know that you do have high cholesterol.' Additionally, at the end, the interviewer recapitulates the agreed exercise plan with the patient to ensure understanding, demonstrating a clear practice of summarizing data to verify and clarify the information gathered. Therefore, based on the consistent and comprehensive summarization after each major line of inquiry, the interviewer scores a 5.",5,"The physician summarizes the data obtained at the end of the conversation, verifying and clarifying the information gathered during the interview. The physician summarizes the patient's goals, medical history, and exercise preferences, and outlines a plan for the patient to start an exercise program, including discussing it with her family members and setting up a follow-up appointment. The physician also checks the patient's understanding of the plan, asking her to repeat what they agreed upon."
QUESTIONING SKILLS - DUPLICATION,5,"The interviewer (physician) does an excellent job of gathering information without unnecessarily repeating questions. Each question appears aimed at building upon the information previously provided by the patient or delving into related areas that are relevant to understanding the patient's condition and needs. There's a clear logical flow in the conversation, where the physician moves from understanding the patient's immediate concerns to a broader medical history, and onto lifestyle factors that could impact the patient's health and exercise plans. No evidence of repeated requests for information already provided is present, indicating a keen attention to detail and ability to retain and utilize the patient's responses effectively. The physician circles back to topics (like beginning an exercise regimen) not for redundant information but to create a comprehensive plan of action based on the patient's inputs, which aligns with seeking repetition for clarification or summarization where necessary.",5,"The physician does not repeat questions unnecessarily and only seeks repetition for clarification or summarization. The conversation is well-structured, and the physician takes notes and reviews them to ensure they have all the necessary information. The physician also summarizes the plan and agreements with the patient to ensure understanding."
QUESTIONING SKILLS - LACK OF JARGON,5,"The interviewer, in this case a medical student named Cheyenne, uses language that is easily understood by the patient throughout the conversation. Cheyenne avoids medical jargon entirely, opting instead for straightforward, accessible language that a layperson can easily grasp. For instance, when discussing the patient's high cholesterol, the term 'Lipitor' (a medication) is used without delving into medical specifics about the drug, ensuring the patient understands without overwhelming them with jargon. Furthermore, terms like 'C-section' and 'disc operation' are used in a way that the patient would likely be familiar with, considering her medical history. Additionally, the discussion on starting an exercise program, including the potential benefits of exercise and suggestions for types like swimming or using gym machines, is presented in a very relatable and understandable manner. Cheyenne also explains the role of a personal trainer in a gym context in plain language, making it clear for the patient. This approach ensures that the patient can follow along and contribute to the conversation without feeling confused or needing further clarification on medical terms.",5,"The physician uses language that is easily understood by the patient, avoiding medical jargon entirely or explaining any technical terms immediately. The conversation is conducted in a friendly and non-intimidating manner, with the physician taking the time to clarify any points that may be unclear to the patient. The physician also uses simple and concise language to explain complex medical concepts, such as the benefits of exercise for heart health and the importance of considering the patient's back pain when designing an exercise program."
QUESTIONING SKILLS - VERIFICATION OF PATIENT INFORMATION (in vignette),5,"The interviewer, a medical student acting under the title physician for the interaction, consistently engaged in clarifying, verifying, and specifying the patient's responses throughout the conversation. For instance, they confirmed the patient's preferred name ('So what would you like me to call you?'), medical history and medication ('Do you take anything for it?'), and details about past surgeries ('Could you tell me about those?'). They also verified understanding of the patient's exercise motivations and concerns ('So you are interested in starting an exercise program because...'), checked for any potential barriers to exercise ('Is there anything that you think would stop you from exercising?'), and ensured they had detailed personal and family history ('Tell me something about your family. Who do you live with?'). Furthermore, the interviewer made a conscious effort to ensure the patient understood the discussed exercise plan by summarizing it ('So just to make sure that I explained that clearly...could you tell me what we just agreed upon and what you got from that?'). These examples highlight the interviewer's thorough approach in seeking to clarify, verify, and specify patient responses, ensuring no significant gaps were present in their understanding. Therefore, a score of 5 is appropriate.",5,"The interviewer consistently seeks to clarify, verify, and specify patient responses, ensuring an accurate understanding of the patient's statements. The interviewer asks open-ended questions, encourages the patient to elaborate, and paraphrases the patient's responses to ensure understanding. For example, when the patient mentions being tired, the interviewer asks follow-up questions to clarify the duration and potential causes of the fatigue. The interviewer also seeks specificity when discussing the patient's medical history, exercise habits, and goals. Additionally, the interviewer summarizes the patient's responses and outlines a plan for the patient to start an exercise program, ensuring that the patient understands the next steps."
INTERACTIVE TECHNIQUES,5,"The interviewer, in this instance, demonstrates a predominant patient-centered interviewing style, making efforts to understand the patient's concerns, lifestyle, and preferences before prescribing an exercise program. Quotes such as 'So what brings you into the office today?', 'Tell me why you want to start an exercise program.', and 'Is there anything that you think would stop you from exercising? Anything that you're worried about?' illustrate an approach focused on gathering insights from the patient's perspective and encouraging them to share their experiences and concerns. This method builds rapport and involves the patient in the decision-making process. Although the physician leads the conversation towards actionable health advice, the seamless integration of physician-centered techniques like gathering medical history and suggesting a follow-up is done in a way that supports the patient's initial inquiry about starting an exercise program. The interviewer solicits the patient's input on their preferences for exercise, potential barriers, and social support, and tailors the advice accordingly to include family involvement and addresses concerns about gyms and the patient's medical condition. The balance is maintained throughout without the physician reverting solely to a physician-centered approach or failing to achieve a collaborative agenda. Therefore, the conversation promotes a collaborative partnership between the patient and medical professional.",5,"The interviewer consistently uses a patient-centered technique, allowing the patient to share their concerns and goals. The interviewer effectively incorporates physician-centered elements, such as asking about medical history and potential underlying medical problems, to promote a collaborative partnership between the patient and doctor. The interviewer also actively listens to the patient, responds empathetically, and provides explanations and education about the benefits of exercise. The interviewer negotiates the agenda with the patient, setting realistic goals and expectations for starting an exercise program."
